{
  "schema_version": "0.5",
  "gradient_id": "11111111-1111-4111-8111-111111111111",
  "boundary_id": "finance-01__safety-01",
  "region_a": "finance-01",
  "region_b": "safety-01",
  "metric": "activity_pressure",
  "value_a": 0.85,
  "value_b": 0.35,
  "gradient": 0.5,
  "method": "absolute_difference",
  "window_start": "2026-10-04T03:00:00+09:00",
  "window_end": "2026-10-04T03:05:00+09:00",
  "comparison_state": "complete",
  "temporal_alignment": {
    "mode": "same_window"
  }
}
